Rubric,Description
Independence,Not influenced or determined by someone
Indifference,"Lack of interest or anxiety towards children, business or loved ones"
Indignation,An intense deep felt resentment or anger aroused by an unjustice or wrong they had suffered
Indiscretion,An act at variance with the accepted morality of the society
Indolence,"Lazy people, who would not like to work"
Industrious,A disposition to be constantly or habitually occupied
Infantile behavior,"An adult behave like a child, lacking maturity"
Inflexible,Adhere in firmly to a particular intention or purpose
Inhibition,Lack of social inhibition
In humanity,"Unsympathetic, barbarous attitude"
Initiative lack of,Lack ability to begin a task
Injustice cannot support,Reluctant to support violation of rights of another
Inquisitive,"Curiosity but of a negative aspect, not so innocent"
Insanity,Madness or unsoundness of mind
Insecurity mental,Want of self confidence
Insensibility,Unresponsive or uncreative to his surroundings
Insolence,"Disgracing others, rude and immoderate in language and attitude"
Instability,A fluctuating mind that keep on changing from time to time
Intellect predominate emotions,Head rule over the heart in making decision
Intellectual,rational rather than emotional
Intelligent,"Having high degree of IQ, mentally acute"
Intemperance,Lack of moderation especially in the excessive consumption of alcoholic beverages
Interruption,A person gets irritated when disturbed in his doings
Intolerance,Not enduring difference of opinion
Intoxication,Strange feeling as from joy or pleasure and looking as if drunk
Intriguer,Build up secret plots against others
Introspection,"Self-examination, looking into himself"
Introverted,"Direct inward, concentrate on oneself"
Irascibility,"Easily influenced by anger, short tempered"
Irksome,"One feels as if everything is irritating for him, upset on pretty things"
Irony,Hurt others by contemptuous or mocking statements
Irreligious,Indifference to religion
Irrational,Incapable of reasoning affected by loss of mental activity
Irresolution,Unable to decide
Irritability,Easily upset
Isolation sensation of,"Forsaken feeling, feeling of segregation"
Jealousy,Prosperity of another not tolerable
Jesting,Making merry by word or action
Joyless,Not having a feeling of happiness even if there are occasion
Joyous,Looking happy or pleased despite adverse circumstances
Jumping,raising in a sudden manner with force for coming down
Kicking,A tendency to strike with legs
Kill,A disturbed state of mind charecterised by an impulse to kill
Kindness,Affectionate with sympathy and compassion
Kissing,To touch or press with lips
Kleptomania,Tendency to steal without any economic motive
Kneeling,Asking for something in kneeling position
Laconic,Speaking in few words
Lamenting,An earnest request for grief
Languages inability for,Inability to grasp or learn language as in MR
Lascivious,Attracted towards sexual thoughts and acts
Late,"Slow, does not perceive the value of time"
Laughing,An expression of pleasure by producing a sound showing teeth
Laziness,Aversion or  reluctance to work
Learning,Ability to study or understand
Lecherous,Lascivious thoughts
Lethargy,Weakness
Levitation,A light manner or attitude especially in inappropriate situation
Lewdness,Exposing body - a voluntary act
Libertinism,"Immoral people behave in perverted manner, against social custom"
Liar,Never speak the truth
Listless,No pleasure in his work & act without energy- indifference
Litigious,Tendency to take others into court for minor reasons
Lively,A pleasurable love & affection
Loathing,"A feeling of aversion to everything, disgust"
Locality errors of,Making mistakes in locating places which are familiar to him
Loneliness,"A feeling of being left alone, isolated"
Longing good opinion,Desire to get good opinion from others
Looked at,He cannot tolerate to be watched or observed by others- feels they are mocking at him
Loquacity,Excessive talking in a sound personality
Love,An expression of ones affection towards others
Low minded,Level of thinking is always petty and they are looked down upon by others
Low spirited,A mild hearted may become sad & dejected whenever faced with failures
Ludicrous,"Laugh at most serious & important things, subject of laughing to others"
Lypothymia,Mental exhaustion from grief
Madness,"Unsoundness, mental capacity is lost"
Magnetised,Wants to be influenced by a person with a stronger will than he is
Malicious,Making plans to harm others
Malingering,Feeling of being ill in order to attract attention or sympathy
Mania,Excitement of psychotic proportion manifested by mental & physical hyperactivity
Mani-A-Potu,Delirium tremens- an alcohol withdrawal syndrome
Manipulative,Corrupt & dishonest
Mannerly,Polite & obedient
Mannish,Resembling a man- girls dress & behave like a man
Manual work,Mental aggravation whenever engaged in any physical work
Marriage un endurable,"Dislike even the idea of marriage, may or maynot be due to the idea of responsibility associated with it"
Mature,A young child behave like an adult and astonishing people around him
Meddlesome,Interfering in others matters which may not concern him
Meditating,A devotion or spiritual exercise with deep thoughts and is generally inattentive what is going around him
Megalomania,Ambitious people have desire for power wealth & fame - rulers who always fight wars to expand their kingdom
Melancholy,"Gloomy state of mind, dejection"
Memory,The process of reproducing or recalling what has been learned
Men dread of,A sense of some disasters happening on seeing a man
Mendacity,"Untruthful, tendency to lie"
Menopause,"Lady may more irritable, depressed or uncomfortable during this period"
Menses,Mental symptom aggravate during menses
Mental exertion agg,The least staring of mind agg the sufferings
Mental power,The power of mind
Merging of self,He is always with nature and can adjust in any circumstances
Merry,Cheerful & happy
Mesmerised being,Wants to be influenced by a man having strong will power
Meticulous,"Conscientious, over caring about details"
Mildness,Gentleness in nature & behaviour
Mirth,"An excessive feeling of happiness even during sickness, a deviation from normal happiness"
Misanthropy,Hatred from the whole mankind
Mischievous,Tendency to cause harm or trouble to others
Miserable,Great unhappiness or helplessness with extreme pain
Miserly,A great desire to save money even when occasions where it is considered necessary to spend
Misery,Great unhappiness sorrow with pain
Misfortune,bad luck and disaster
Mistakes,An act of error committed by a person without have an awareness of the consequences due to pre occupation of mind.
Moaning,Making a low prolonged sound due to pain
Mocking,A type of maltreatment intentionally done to humiliate or offend others
Modesty,Tendency to under estimate one's own talent abilities and values
Monomania,Exaggerate obsession or enthusiasm about a single idea - derangement restrict to one idea
Mood,"A representation of feeling which may be good, bad, changeable or alternating"
Moon light,Feel some changes in their life with changing moon faces
Moping,Gloomy state of mind
Moral feeling want of,"Lack of humanitarian consideration in actions, thought and conduct- very low principles in life"
Morose,A bitter unsociable discontent person dislike contact with people
Morphinism,Drug addiction
Mortification,"A feeling of shame, humiliation caused by something that wound one's self respect"
Muddled,Confused
Murder desire to,Disposition to kill some body
Murmuring,A low continually repeated sound
Mutilating body,Mental disturbance in which disfiguring his body by cutting
Muttering,A low rumbling voce representing his complaints in angry way
Nagging,Scold and continually quarrelling
Naïve,"Simple trusting, plain and always takes things at their face value"
Narrow minded,"Lacking tolerance, petty"
Neglecting,Fail to give proper attention & care
Nervous,Anxiety with excitement
Neurasthenia,Nervous debility causing fatigue
Neurosis,A psychological disorder in which anxiety predominating
New,Entire object despite very old are looking new
Nibble,Bite gently and repeatedly
Night terror,"Fearful dream child awake frightened - cannot remember in the event, occur in early part of night"
Nightmare,"occur in last part of the night, awake frightened, and remember the events. In both case observer find the patient is frightened."
Nostalgia,Home sickness
Numbers,tendency to draw even numbers
Nymphomania,Increased desire for sex in females
Objective reasonable,Un influenced by emotion or personal opinion
Obligations,"A moral or legal bond , a dept of gratitude"
Obscene,Offensive to accepted standard of decency
Obsequious,"Submissive up to slavery, all time on others opinion, no complaints"
Obsession,A persistent thought on disagreeable occurrence by compulsion Eg. OCN
Obstinate,Inflexible firmly adhering to an opinion by argument
Occupation amel,"An activity , business or profession provides amelioration to all complaints"
Occupied,Always busy with things closed to him in his surroundings
Odds,Dissatisfied or discontented with himself
Offended easily,Sensitive person feel insulted very fast and takes most harmless remark as hurt feeling
Older,A precocity in which child behave as a matured person
Opinions,"Wants to be respected by others, will not tolerate any contradiction"
Optimistic,"Always expect a favorable out come, no matter how grim thing seems"
Order in one's life,Wants every thing in perfect orderly manner
Orphan,Forsaken children
Over active,Always wants to be busy and occupied
Overbearing,"Proud of her own looks or cloths, looked down upon others with contempt"
Over sensitive,Extremely susceptible to feel something - pain or happiness
Overwhelming,Very proud and c haughty person
Over worked,complaints from over work
Panic,Sudden attack of fear
Paradoxical,That which contrary to received opinion
Paranoia,Delusion of persecution or grandeur- as a King
Partial,"Prejudiced or biased, favoring one person or side over another"
Passionate,Capable of having intense feeling
Pathetic,Arousing pity or sympathy from others
Patience,Power to bear anything calmly and coolly without any provocation
Peace,A sense of extreme calmness and contentment
Pedant,Unduly concerned with book learning and formal rules without understanding or experience
Pedophilia,Desire for sexual intercourse with children
Perceptions,"Insight, product of perceiving"
Perfectionist,A predilection for setting extremely high standards and being displeased with anything else
Perfidious,"Faithless, violating faith"
Perseverance,Try to full fill any condition whatever may be the consequences- not give up easily
Persist in nothing,Jumping from one thing to another without any purpose
Pert,Impudent in speech or conduct
Pertinacity,Persist or holding firmly even if others disagree
Perverse,Want of moral feeling
Pessimist,Take least hopeful view on any situation
Pettiness,A thing of little value given lot of importance
Petulant,Peevish or irritable person for no apparent reason and behave crossly with every one
Philosophy,Love and pursuit of wisdom by intellectual investigation and moral self discipline
Phlegmatic,Indifference marked by slowness & solidity
Photo mania,Desire for light and color
Picking,During the course of sickness he plucking & picking anything like clothes
Piety nocturnal,Moral & spiritual reasoning at night only
Pities herself,Sympathetic & heartfelt sorrow for herself while suffering mentally & physically
Placidity,"Peaceful & free from agitation, undisturbed and calm"
Plaintive,Expression of sorrow
PLANS making many,"This individuals have a habit of wanting to do many things which is not always practical or possible. The person is desirous or expanding his present business for a while he will make many statements, charts, graphs or other things although he may not implement them."
Theorizing,"The person has no definite plan, statement, graph etc. but he makes castles in the airway, but it is not so in plans making many."
Plants,lover of nature & plants. Green peace movement
Playful,Full of good spirit & fun
Pleasanty,Full of fun & jesting
Pleasing,Desire to please others
Pleasure,Agreeable sensation of emotion giving gratification or enjoyment to the mind
Polite,submissive
Politics ability for,Relating to study structure or affairs of government politics or the state
Pompous,Marked by an exaggerated show of dignity or self importance with an air of superiority
Positivness,"Affirmative, self assured, positive in all affairs and reach their objectives"
Postponing everything next day,A lazy person has the habit of delaying or putting work to tomorrow
Power love of,Great desire and ability to control & compel others
Praised being,They wishes to have good thing told about him
Praying,"Religious minded , devote their maximum time for prays"
Precocity,"Attainment of early maturity, development of mental faculties before the proper age"
Predicting,Power to perceive things that are naturally beyond the range of human sense
Prejudiced,Bias or posses ness of mind
Premonition,Presentiment of the future in advance
Pre menstrual symptom,"Anger, irritability, depression etc just before menses"
Pre occupied,"Lost in thought, absorbed from look itself"
Presumptuous,Bold and over confident
Pride,An unreasonable opinion of one's own excellence
Prim,artificial behaviour designed to impress others
Procrastinate,Postponing or putting of something until its later date
Profanity,Disrespect towards the religious things
Prophesying,Foretelling future events
Protesting,They rebel against any authority or ruling power
Proud,Haughtiness
Provoke,"To excite, stimulate or incite others"
Prying,To examine things with impertinent curiosity
Pulling hair,Desire to draw out one's hair
Punctilious,Arriving or reacting at the designated time
Pyromania,Fire mania
Quaking,Sound produced by ducks- occur in mania
Qualmish,Bitter regrets arising from the repentance of past misdeeds
Quarrelsome,Disposed to fight for pretty matters
Queer,"Open to suspicion, counter fit"
Quick to act,He has quick reflexes and react very fast due to great co-ordination of ideas and actions
Quite disposition,Tendency to remain calm and peaceful
Quitted cannot,So agitated or restless and not possible to keep quite or calm
Rage,He has no control over his anger and behave in violent manner
Rakes,Immoral personalities
Rash,Quality of acting hastily and incautiously
Reading av to,A settles and vehement desire not to read
Reality flight from,When faced with facts or difficult situation he tries to escape and live in imaginary world
Reason increased power of,"Increased intellectual faculty ,have logical explanation for every little incident in life"
Rebellious,"Revolt, resents and resist authority"
Reckless,Careless or heedless of consequences
Recognize anything,One ceases to identify his own friends
Recriminating,Remain absorbed in nostalgia and bad memories
Relenting,An attentive consideration with introspection
Rejecting every thing,"He does not accept things offered , capriciousness"
Religious,Committed to the service of divine or religion
Relocating,Have a desire to change or misplace things from their place
Remedies homeopathic,Aversion to homoeopathic medicine
Remorse,"painful memory of wrong doing, bitter regrets arising from the repentance of past misdeed"
Renunciation,"Self resignation, self denial"
Repose,To rest in confidence
Reproaches,"Ailments after disappointment and disapproval - they blame oneself for something, they lack self confidence"
Repulsive mood,"A tendency to reject anything irrespective of its quality, does not appreciate efforts by others, nothing give him satisfaction"
Resentment,Feeling of anger or irritation caused by insult
Reserved,"Introvert, self restrained in behaviour and expression"
Resignation,"Condition around does not agree very well even though he wants to change it , he cannot- he give up position because he cannot cop up with stress and strain"
Resolute,"Firmness, determination and boldness enough to face circumstances against all odds"
Respected desire to be,Want to be respected by everybody even though he is not in a good status
Responsibility av to,Try to avoid any important job or promotion given to him
Rest,"Cannot when things are not in proper place, OCN, always cleaning up and put things in order"
Restlessness,"Unable to rest, hyperactive people who are full of energy and desires a constant change"
Reticent,Reserved in speech
Retirement desire for,Desire to withdraw from company or occupation or responsibility
Revealing secrets,Making Known the facts which are supposed to be maintained as confidential
Revengeful,Take revenge by harming somebody whom had harmed earlier or suspected to have harmed in any way
Reverence,"Fear mingled with profound respect, showing highest degree of respect to the point of worship"
Reveres,"Day dream, lost in thought"
Revolutionary,Those who have rebellions thought against any authority or ruling power
Rich,Desire to be rich in wealth & money
Ridiculous action,"Action designed to excite laughter with some degree of contempt, mockery, but without having a very good and sensible aspect on it."
Gestures,"are involuntary movement of the organs of the person, but ridiculous action - not such the action presented may be deliberate, yet this is to be considered in that very rubric"
Riding in carriage av to,Who dislike travel in carriage
Right always claim to be,He never accept others opinion and feel that only his judgment will lead to success
Rigid,"Firmly adhering to an opinion or purpose, inflexible"
Romantic,An opinion attitude or idea based on feelings/emotions rather than reason
Roving about naked,Perverted mind wants to expose in public
Rudeness,"A general & habitual deficiency in manner and grace, no respect"
Rules,"Aversion to obey the rules, rebellion"
Runs about,Desire to run away or try to run here and there
Sadness,"Unhappiness or sorrow , a general term without implication of intensity"
Sarcasm,A mocking ridicule intended to wound others
Satyriasis,Excessive and uncontrollable sexual desire in man
Scape goat,A goat on which laid sins of Jewish and then allowed to escape one who made to bear others mistakes
Sacred,Frightening and terrifying
Skepticism,Doubt full and disbelieve
Schizophrenia,Split personality with withdrawal from reality
Scoffing,Feeling or showing open disrespect
Scolding,Always finding faults and quarrelling by harsh language
Scorned,"An expression of extreme contempt , but has been in silence"
Scowl inclination to,Wrinkle brows to look gloomy or threatening
Scraping with hands,"A symptom of delirium, tear or mark the surface with hands"
Screaming,A sudden sharp cry indicates sudden terror or fear he has just experienced
Scrupulous,Have principles and moral integrity in all the deeds
Searching,Search for something on the floor as if lost which may draw the attention of others also
Secretive,"Reliably close mouthed, maintain privacy in all affairs of life"
Secrets divulges,Revealing secrets which are of confidential nature
Self control,Strong will power and are able to exercise control over their emotions and actions
Self deception,"Deceiving oneself, mislead to do something due to one's own illusion"
Self denial,Forbearing to gratify ones own appetite and desires
Self esteem,Good opinion on oneself
Self indulgence,Undue gratification of ones own appetite and desires
Self torture,Inflicting punishment to oneself for the sin feel he had committed
Selfishness,Self centered person care for no one but only own
Selflessness,Concerned about others rather than one self
Senses,Good power of perception & reasoning that even slightest change in their surrounding is immediately felt
Sensitive,Most trifling ailment will upset him to such an extend that it cannot be tolerated
Sensual,"Indulging in sensual activities, lewd and voluptuous"
Sentimental,"Heart rule over the brain, attitude based on feeling or emotions rather than reasons"
Serene,Calmness of mind and kindly disposed towards everyone although he might be suffering from serious problem
Serious,Grave in disposition or manner not in happy mood
Servants desire to have,Desire to have some one to help
Service,"Always depended on others opinion, no complaint"
Sexual excess,Mental complaint arising after excessive indulgence in sex
Shameless,"A voluntary act by which exposing body, lack of modesty and decency"
Shy,"Avoiding observation by others , tendency to keep way"
Sighing,Exhale audible long deep breath as in grief or to express pain
Singing,Marked desire to sing continually even during severe illness
Sitting inclination to,Inclination to sit irrespective of his surrounding even though there is no seat available
Size incorrect judgment of,"Incorrect assessment of size, gravity of situation or problem"
Slander disposition to,Formulating false stories in order to impair public reputation of others
Slovenly,Habitually careless about their looks even though financially sound
Slowness,Inability to perform any work with fast or normal speed
Sluggishness,"Disinclination to activity, mentally dull with poor understanding inability to do anything"
Sly,"Inclined to cheat , committing fraud and give false witness in court"
Smaller thing appear,Everything appear smaller to him
Smiling,To express pleasure always
Snappish,Speaking curtly. They are tense worried overworked angry person uttering sharp words
Snarling,Barking or growling like a dog
Sneering at every one,Facial contortions that expression contemptuousness to every one
Snub,Ignoring or behaving coldly towards others in a sarcastic manner
Sobbing,Weep with audible convulsive catches of breath
Soberness,"Straight forward, earnest in their dealings and manners"
Sociability,Fitted for companion ship
Solemn,Does not like to deviate from norms
Solitude,"A desire for loneliness, do not like to mingle with society"
Somber everything that is,"Not satisfies, everything seems to be in a blue condition"
Somnambulism,"An action performed while sleep, not able to recall later"
Sopor,Deep stupid sleep
Sorrowful,Sadness expressing sorrow
Spaced out feeling,"Stupefaction of mind, empty feeling"
Spineless,No courage or dare to do anything
Spiteful,"Petty unwanted annoyance, other person feel offended"
Spitting,Impulse to spit in face of people - an involuntary action
Spoiled children,"Conduct disorder , children had over indulged or pampered"
Spoonerism,Transposition of initial sounds of spoken words
Spying everything,Investigate secretly
Squandering,"Spend money unwisely, unwanted purchase, worthless investments"
Stage fright,"Anticipation on stage, in presence of people"
Staring,"Look fixedly with wide open eyes, totally blank"
Starting,Wake suddenly from sleep
Stating,Very difficult to narrate her complaints
Stereotypic,"A conventional or traditional idea, no sense of creativity and apprehensive to try out anything new"
Strange things impulse to do,Wants to unusual things not done by anybody before
Stranger sensation,Feeling of one self to b a stranger may occur after high fever
Strength increased mental,Mentally strong enough to sustain & withstand stress and strain
Stressed,"Affected by strain, pressure or force"
Striking,"Touching something with a speed of force, like an accident which may draw attention of others"
Stubborn,"Obstinate, admen to his thoughts and actions"
Studying difficult,Dull sluggish and lack concentration
Stunned,Lose consciousness due to sudden event or news
Stupefaction,Astonished and being amazed
Stupidity,"Unintelligent behaviour, they are intellectually dull and not doing such act deliberately"
Succeed never,"Very hard working person met with repeated failures, now he feel that he will never succeed"
Suggestions will not receive,"Unwillingness to accept advices, they never follow other people suggestions even though it is for their own good"
Suicidal disposition,Intentionally killing one self
Sulky,Silent inactive and unsocial attitude in dejected persons. He will talk only to the extend of his purpose served
Sullen,Gloomy and oppressed after being offended
Summing up difficult,Very weak in mathematics
Superstitious,Old unreasonable obsolete beliefs which cause dread and fear
Susceptible,Oversensitive people affected and influenced by deep emotions or any external factor
Suspense,Creating a type of anxiety or anticipation
Suspicious,"Distrustful people always suspecting a wrong being done to them, without sufficient evidence or proof"
Swearing,After heated exchange make an oath to inflict a doom or misfortune on other Person
Swooning fits,Sudden fits or faintness
Sympathetic,"Friendly sensitivity to other's emotions, even to those who are not very close to him"
Taciturn,A gloomy person wants to be left alone
Talented,Special aptitude
Talkative,Disposition to enjoy conversation to n unlimited end
Talk alone when,Talk to themselves either about their anxieties and fears even though there is no one around
Talk desire to some one,An intense desire to talk to some one for self satisfaction
Tearing,A destructive tendency to destroy things by tearing them
Teasing,To irritate for the purpose of provocation
Temerity,Over confident & rash
Tenderness,Warm friendly affectionate people
Testament,Refuse to make a written document
Theorizing,Makes many plans without any head or tale
Thinking aversion to,Lazy and indolent people dislike to think on any aspect
Threatening,A disposition to utter threat even on petty matters
