Rubric,Description
Throwing things around,Tendency to throw things in anger
Thunderstorm,All the mental complaints and sufferings increase before or during a thunderstorm
Ticklishness,Titillating or stir up to pleasure
Tics,Gestures or convulsive motions of certain muscles
Tidy,Fastidious neat clean and orderly people
Time fritters away,Wasting time without having any purpose
Timidity,"Shrinking from public attention, fear of facing a person or situation"
Tipsy,Stupefaction of mind
Tolerant,Power to bear anything calmly and cannot be easily provoked
Tormenting,To put extreme pain anguish and distress to those around him with his minor complaint
Torpor,A state of mental or physical inactivity with sluggishness and stagnation of functions
Torturing,Threatening and tormenting
Trance,A detachment from physical surroundings. Observed when a person totally absorbed in deep concentration especially when listening to music with eyes close and meditating
Tranquility,"Peaceful, calm and undisturbed mind"
Trapped,Delusion or feeling of being trapped
Trauma mental,Symptoms arising after mentally injured or emotionally disturbed
Traveling,"Cosmopolitan, feeling of satisfaction by traveling"
Tribadism,Homosexuality
Tricky,Inclined to cheat and committing fraud
Trifles,A thing of little value given too much importance
Truth telling the plain,"They prefer not to lie even if beneficial, come forward and admit their faults"
Twilight agg,Mental symptoms are aggravated during the faint light- before sunrise and after sunset
Un attractive things seems,"Every thing look un attractive , lacking beauty and charm"
Unconsciousness,Un aware of his surroundings
Understanding not,Unable to comprehend fully
Undignified,They have low self esteem and undertake things without dignity - not given the respect they might deserve.
Unfeeling,Hard hearted having no sympathy
Unfortunate feels,"A feeling of ill fated unsuccessfulness, devoid of have blessing from God"
Unfriendly humor,Not kind or favorable
Un gracious,"Lacking social grace, unpleasant & wicked"
Ungrateful,Never appreciate what others are done for him and do not express their gratitude
Unification,A brotherhood feeling
Un observing,Lack of observation or failure to notice
Un real everything seems,"Lacking in truth, whatever visible to him feel unreal"
Un reasonable,Immoderate and make absurd demands
Un reliable,Not to trusted or relied upon
Untidy,"Very careless about their dress, work or ideas"
Unworthy,Not conforming to the standards
Up heave,A type of excitement in which he rise upwards
Usurer,One who lend money in illegal & fraud way
Vacillations,Inability to take stands and fluctuate in their opinion
Vanity,Always pre occupied with their appearance achievements and belongings
Veneration,"Deep respect, showing respect excessively"
Verify everything,"OCN, checking everything frequently"
Verses,Habit of representing thoughts and desires in a poetical manner
Vexation,Disturbed and un easy person may feel the smallest occurrences troublesome and annoying. They feel angry or harassed on little matters
Vindictive,Inclined to seek revenge when hurt or insulted
Vivacious,"Full of life animation, enthusiasm & spirit even if faced difficulties"
Vulnerable,Susceptible to attack emotionally
Wailing,To protest by making high pitched prolonged sound suggestive of a cry
Wandering,Traveling here and there aimlessly
Watched,Observant and vigilant person always being very alert
Wearisome,Causing mental or physical fatigue
Weary of life,"Due to frequent set back in life, mentally and physically fed up with life with no desire to survive as life is felt as a burden"
Weeping,To express grief or anguish by tears
Whimpering,Soft intermittent crying
Whimsical,Un predictable erratic mood or actions. He will not listen to any one and will not budge an inch from his thought
Whining,A prolonged high pitched cry usually expressing a distress
Whistling,A disposition to produce sound like whistling in musical minded or light hearted
Wicked disposition,Evil in principles and practice
Wild feeling in the head,"Turmoil, wild type of impulses rendering a person not amenable to human habitation"
Wildness,Rough personalities with irregularity of manners and ungovernable emotions
Will full,Obstinate and head strong
Will contradiction of,Lack of coordination in the desires and execution of these desires by body parts
Willy,Cheating and deceitful
Witty,Power to amuse and express quickly
Woman mannish,Woman who have desire to dress and behave like a man
Work av to mental,settled dislike for any sort of mental work
Worry,Painful or apprehensive uneasiness
Wretched,"Miserable, marked or affected by un happiness and sorrow"
Wrong everything seems,A false sort of felling where he declare everything wrong or it appears wrong to him. Are dissatisfied and make life miserable to others also
Yielding,"Very flexible and adjustable. Agree to demands made by others, even if they want to do otherwise"
Zealous,Enthusiastic devoted person in pursuit of perfection
